Place Name,Address,City,Rating,Total Ratings,Latitude,Longitude,Type,Description
Mine Creek Civil War Battlefield State Historic Site,"20485 KS-52, Pleasanton",Pleasanton,4.6,129,38.1450211,-94.72343579999999,"park, tourist_attraction, point_of_interest, establishment","The museum did have some interesting artifacts, information and beautiful trails.  We were also warned about ticks.  Make sure that you spray yourself before you go on the trails."
Battle Of Island Mound State Historic Site,"NW County Raod 1002, Butler",Butler,4.6,89,38.2351761,-94.4398796,"tourist_attraction, park, point_of_interest, establishment","Easy stop, quick visit, but a cool piece of history. The trail was well maintained and the bathroom was also well maintained.  Check out my instagram post on this site: @mikeisoutside"
Mine Creek Battlefield Interpretive Walking Trail,"20485 KS-52, Pleasanton",Pleasanton,0,0,38.14463689999999,-94.72353199999999,"point_of_interest, establishment",No description available
Battlefield Cemetery,Pleasanton,Pleasanton,0,0,38.1221656,-94.7233876,"cemetery, point_of_interest, establishment",No description available
Shiloh Creek,"Shiloh Creek, United States",United States,0,0,37.8919166,-94.6160428,"natural_feature, establishment",No description available
Mine Creek,"Mine Creek, United States",United States,5,5,38.1599532,-94.6803386,"natural_feature, establishment",A very well put together and maintained museum depicting the civil war. The walking trails through the battlefield are well kept and easy to maneuver
