city,description,location,state,longitude,latitude
Wichita,Reports of lights flickering on and off only in the rooms not in the hallway. Within seconds of leaving a room furniture would be rearranged. The doors while they shake violently only to find no one on the other side.,The Broadview Hotel in Old Town,Kansas,-97.342446,37.686398
Wichita,"it is said that locker 303 is haunted by a little girl who got raped and killed in the auditorium, then got stuffed in the locker. if you go down that hallway by yourself, people say that you can smell her deceased body from the locker. it is also said t",Brooks Middle School,Kansas,-97.2914214,37.7350239
Wichita,for almost 150 years ghost hunters and curious people have traveled to an old crumbling bridge near Wichita known to be haunted by restless spirit of an agonized mother desperately seeking her murdered baby. the restless spirits of many of dead continue,Jesters Creek/Theorosas Bridge,Kansas,-97.374042,37.883106
Wichita,"People have been known to hear strange sounds while performing maintenance on the aircraft, and lights going on and off without any explanation. They say on Halloween night if it is foggy out, a WW2 aircraft with appear to land on the runway then disappe",McConnell Airforce Base,Kansas,-97.2469636,37.6410754
Wichita,Amateur ghost hunters claim to have captured a child's voice and capture anomalies on film.,Rest Haven Cemetery,Kansas,-97.4787686,37.6646137
Wichita,"There's a lady/girl that walks around the hall ways after dark. She makes the locks of the lockers clank, and bounce against them.",Robinson Middle School,Kansas,-97.2796172,37.691072
Wichita,"Many students have complained of mysterious footsteps and unknown knocking on doors, and closing and shutting of doors, televisions turning on by themselves. gray dress when followed her she disappears.",Wichita State University,Kansas,-97.2928693,37.7193933
Wichita,"Wilner Auditorium -  several accounts of voices, doors opening and closing, and lights flickering have been noticed by students. The ghost is believed to be that of building namesake.",Wichita State University,Kansas,-97.2928693,37.7193933
