Place Name,Address,City,Rating,Total Ratings,Latitude,Longitude,Type,Description
Fort Scott National Historic Site,"199 Old Fort Blvd, Fort Scott",Fort Scott,4.7,979,37.8434508,-94.7042879,"tourist_attraction, museum, park, point_of_interest, establishment","Fun place to take the kids to talk about historical challenges, easy to access, no wait, cute gift shop. We enjoyed it!"
Allen County Historical Society,"20 S Washington Ave, Iola",Iola,4.8,26,37.9215804,-95.40575390000001,"museum, point_of_interest, establishment",It is an extremely fascinating place to learn the history of Allen County and view different artifacts from past!
Battle Of Island Mound State Historic Site,"NW County Raod 1002, Butler",Butler,4.6,89,38.2351761,-94.4398796,"tourist_attraction, park, point_of_interest, establishment","Easy stop, quick visit, but a cool piece of history. The trail was well maintained and the bathroom was also well maintained.  Check out my instagram post on this site: @mikeisoutside"
Missouri Welcome Sign,"1360 S 100 Rd, Fort Scott",Fort Scott,4.5,15,37.8417174,-94.6161551,"point_of_interest, establishment","It's a nice sign, I wish they would do something cooler like Colorado has, but it's not bad 😅"
William Mills House,"212 1st St, Osawatomie",Osawatomie,5,1,38.503283,-94.942056,"point_of_interest, establishment",An architectural masterpiece designed by George F Barber
Miami County Kansas Historical Society & Museum,"12 E Peoria St, Paola",Paola,4.7,30,38.5727047,-94.8772177,"museum, tourist_attraction, point_of_interest, establishment","Visited to see the annual Miniature Art Exhibition hosted in the Museum. The exhibition is a must see as it showcases wide variety of miniature paintings from all over the world. The Museum on its own is well curated with various artifacts associated with local and Kansas history. The staff were friendly, knowledgeable and answered every question with immense patience. Hidden jewel for history buffs."
Asylum Bridge,Osawatomie,Osawatomie,4.6,35,38.50516349999999,-94.941989,"point_of_interest, establishment","Absolutely beautiful, stunning, kind of falling apart, but mother nature is not a force to be reckoned with. heh I love visiting famous and historic old bridges and I was quite shocked to not see any “No Trespassing” sign on the entrance to the bridge, it is gated, but maybe that’s just for safety concern?. I wasn’t about to walk across those rotten planks to the gushing tide beneath. 😅

I’m from Ottawa and we have a similar bridge in our town built in 1903 - Warren Truss Bridge however our bridge has been restored and it’s been converted into part of the Flint Hills Nature Trail!

This bridge looks like it could use a little restoration maybe, But then again, if you cross the bridge, you end up at the back of the Osawatomie Asylum so I can understand why they probably don’t want a bunch of traffic going through there.

Nevertheless, it’s a new piece of Kansas history and it’s well worth a visit!

Subscribe to “Ridin with Dryden” on YouTube"
Northrup House,"315 East St, Iola",Iola,4.6,8,37.9219756,-95.4000976,"point_of_interest, establishment",Good job on painting it Nich Lohman! 😁👍
Pottawatomie Massacre,Lane,Lane,4.2,17,38.4394078,-95.0840813,"point_of_interest, establishment",It is very cool to see this marker and know the history that happened on this spot. But what was even cooler was playing on the old dangerous playground equipment that resides there now.
Dietrich Cabin,"City Park, Ottawa",Ottawa,4.3,15,38.6106064,-95.26795109999999,"tourist_attraction, museum, point_of_interest, establishment",Visited a few months ago and only saw the outside. Visited today for the open house and had a wonderful time. Becky the guide was very knowledgeable and made this visit wonderful. She made my husband interested in the history and he kept wanting to know more.
Historic Ottawa Trail Bridge (West),"JP95+V3, Ottawa",Ottawa,5,1,38.6196954,-95.2922834,"point_of_interest, establishment","I was born and raised in Ottawa, Kansas and ever sing I was a kid I always hung out with my friends down at the Ottawa second Steeet Dam. The Dam itself isn’t directly connected to this bridge but you can go through the woods like we used to do..

Or just leave Second Street Dam and enter Hope Cemetery, drive to the far northwestern corner and you’ll find the wooden stairs leading up to the Flint Hills Nature Trail.

Follow the trail and you’ll find this beautiful and historic 1903 Warren Truss Through bridge named the “Historic Ottawa Trail Bridge (West)”. The city of Ottawa and others have beautifully restored this whole area and are working around the clock to restore and reconstruct the trail ☺️

Many thanks for bringing this bridge back to life! I see so many more people back here hiking, biking, fishing and so much else since it’s been restored!

+ Subscribe to Ridin with Dryden on YouTube +"
Creamery Bridge,"731 8th St, Osawatomie",Osawatomie,4.5,66,38.5029344,-94.955109,"tourist_attraction, food, point_of_interest, store, establishment",It is a bridge. That's it. We'll there is a gravel parking area and stairs down to the water but the water was high when we were there and it would have been dangerous to swim. There is a small dam just before the bridge but be careful of the reverse current.
Mine Creek Civil War Battlefield State Historic Site,"20485 KS-52, Pleasanton",Pleasanton,4.6,129,38.1450211,-94.72343579999999,"park, tourist_attraction, point_of_interest, establishment","The museum did have some interesting artifacts, information and beautiful trails.  We were also warned about ticks.  Make sure that you spray yourself before you go on the trails."
Long Shoals Bridge,"265th St, Fulton",Fulton,4.8,4,37.99474,-94.62169,"point_of_interest, establishment","Grew up riding over this bridge as a kid. It was a sign we were almost to Grandma's house. It's one of my favorite places to sit and enjoy the quiet of life. The road winds to the new bridge, but you can see where the old road still goes. Definitely my happy place."
Marais des Cygnes Massacre State Historic Site,"26426 E 1700th Rd, Pleasanton",Pleasanton,4.5,104,38.2817795,-94.6211477,"tourist_attraction, point_of_interest, establishment",Very SCAREY place if you're alone. Just the history gives it a weird vibe..very informative site. Hate that somebody dumped their trash there. People have no respect for the history of the UNITED STATES OF AMERICA...worth the drive out of the way and very beautiful countryside...
Arthur Capper Memorial,"508-500 S Cedar St, Garnett",Garnett,4.3,3,38.2798604,-95.23615459999999,"tourist_attraction, point_of_interest, establishment",
Birthplace of Robert A. Heinlein,"805 N Fulton St, Butler",Butler,5,1,38.2653465,-94.3354746,"point_of_interest, establishment","Stumbled across this on our drive, not sure if there is a museum etc. one of my favorite authors and a really neat surprise to find his birthplace and home"
Old Depot Museum,"135 W Tecumseh St, Ottawa",Ottawa,4.7,142,38.620439,-95.269717,"tourist_attraction, museum, point_of_interest, establishment","We truly enjoyed our stop at this museum on the Prairie Spirit State Park trailhead. What made our visit so great was our visit with Mike, the museum guide. He was so anxious to talk to us about the exhibits and point out things we wouldn't want to miss. It is two-stories, that include a large model train town on the first floor, and an old one-room classroom, Victorian living room, kitchen, ice cream parlor, and a general store on the second floor. We stayed over an hour to see all the items that Mike pointed out. We loved the story about the Naked Voters! The museum is free but everyone will want to contribute to the donation box."
John Brown Museum State Historic Site,"1000 Main St, Osawatomie",Osawatomie,4.5,251,38.4988962,-94.959599,"museum, point_of_interest, establishment","This is one of the best small museums I've ever been to. The museum's exterior is meant to look like the armory at Harpers Ferry. The sight of John Brown's infamous last stand. Inside is his cabin. The Adair Cabin was moved from the original spot down the road. It was very cool being inside the cabin, inside the museum. They have some wonderful relics that belonged to the legend himself. The staff were extremely kind and friendly. But best of all was that the allowed my pup inside. That said, my pup, Pennylane is extremely well behaved and exceedingly beautiful. She also loves John Brown and has even been to many of the other relevant sites around the country. Don't miss this gem of a historic site!"
Ripley's smallest tombstone,Butler,Butler,4.4,25,38.2622383,-94.31510430000002,"point_of_interest, establishment","If you enjoy quirky stops on a road trip and you’re in the area, this is one to see. It is very peaceful and sweet, just be sure to be respectful as it is a cemetery. Leave a coin for Ms. Linnie."
